{
  "$schema": "https://json-schema.org/draft/2020-12/schema",
  "$id": "https://virgil.local/schema/manifest.schema.json",
  "title": "HOTEL VIRGIL 컴포넌트 매니페스트 — 티켓 1장",
  "description": "E10 §2 티켓 보드의 기계 소비형 표현. 정본은 docs/design/E10-production.md 이고 이 파일은 전사(轉寫)다 — 어긋나면 표가 정본이며, 해석이 갈리는 지점은 docs/HANDOFF.md 큐로 간다. 검증기: tools/manifest-check.mjs. 소비자: tools/packet-gen.mjs.",
  "type": "object",
  "additionalProperties": false,
  "required": [
    "id", "type", "title", "owner_files", "consumes", "inputs",
    "events", "acceptance", "shots", "forbidden", "model", "depends", "status"
  ],
  "properties": {
    "id": {
      "type": "string",
      "pattern": "^T-P[0-9]-[0-9]{2}$",
      "description": "E10 §2 표의 티켓 id. 파일명과 일치해야 한다."
    },
    "type": {
      "enum": ["level", "rig", "tell", "interrogation", "cinematic", "ui", "audio", "tool"],
      "description": "티켓이 만드는 컴포넌트의 도메인. 페이즈가 아니라 소유 파일이 사는 층을 가리킨다."
    },
    "title": { "type": "string", "minLength": 1 },
    "owner_files": {
      "type": "array",
      "minItems": 1,
      "description": "배타 소유 경로. scope=file 은 파일 전체, scope=section 은 파일 안의 명시된 구역만 소유한다. 한 경로를 둘 이상의 티켓이 소유하면 depends 그래프에서 전순서가 서야 한다(manifest-check R1).",
      "items": {
        "type": "object",
        "additionalProperties": false,
        "required": ["path", "scope"],
        "properties": {
          "path": { "type": "string", "minLength": 1, "description": "저장소 루트 기준 상대 경로" },
          "scope": { "enum": ["file", "section"] },
          "section": { "type": "string", "minLength": 1, "description": "scope=section 일 때 필수. 소유하는 구역의 이름 — 같은 파일의 다른 section 소유자와 값이 달라야 한다." },
          "state": { "enum": ["new", "existing"], "default": "existing" }
        },
        "allOf": [
          {
            "if": { "properties": { "scope": { "const": "section" } }, "required": ["scope"] },
            "then": { "required": ["section"] }
          }
        ]
      }
    },
    "consumes": {
      "type": "array",
      "description": "계약 문서 § 좌표. heading 은 대상 문서에 실재하는 제목 줄의 텍스트(선행 # 제외)와 정확히 일치해야 한다(manifest-check R2). packet-gen 이 이 좌표의 원문을 패킷에 인라인한다.",
      "items": {
        "type": "object",
        "additionalProperties": false,
        "required": ["label", "doc", "heading"],
        "properties": {
          "label": { "type": "string", "description": "사람이 읽는 좌표 표기 — 예: \"E6 §1 로비\"" },
          "doc": { "type": "string", "description": "저장소 루트 기준 상대 경로" },
          "heading": { "type": "string", "description": "제목 줄 텍스트 정확 일치(선행 #·공백 제외)" },
          "why": { "type": "string", "description": "이 절을 왜 읽어야 하는지 한 줄" }
        }
      }
    },
    "inputs": {
      "type": "array",
      "description": "데이터 입력. cg:<id> 는 case-graph.json 의 노드 id(facts·evidence·statements·links·lore·endings·progression 전역에서 해결돼야 한다). doc:<경로>§<제목> 은 문서 좌표. 둘 다 manifest-check R3 이 실재를 검사한다.",
      "items": { "type": "string", "pattern": "^(cg:[A-Za-z0-9._-]+|doc:.+§.+)$" }
    },
    "events": {
      "type": "object",
      "additionalProperties": false,
      "required": ["emit", "listen"],
      "description": "이벤트 어휘는 ARCHITECTURE §5 표에 등재된 이름만 쓴다(manifest-check R4).",
      "properties": {
        "emit": { "type": "array", "items": { "type": "string" } },
        "listen": { "type": "array", "items": { "type": "string" } }
      }
    },
    "acceptance": {
      "type": "array",
      "minItems": 1,
      "description": "기계 수용 기준. cmd 는 실행 가능한 명령이어야 하고(진입 스크립트가 실재하거나 매니페스트 안의 다른 티켓이 산출), expect 는 형용사가 아니라 판정 가능한 결과여야 한다.",
      "items": {
        "type": "object",
        "additionalProperties": false,
        "required": ["cmd", "expect"],
        "properties": {
          "cmd": { "type": "string", "minLength": 1 },
          "expect": { "type": "string", "minLength": 1 }
        }
      }
    },
    "shots": {
      "type": "array",
      "description": "core/shotlist.js 샷 엔트리. state=existing 은 이미 등재된 엔트리(수정 금지·촬영만), state=new 는 이 티켓이 추가할 엔트리(기존 엔트리와 이름 충돌 금지 — ARCH §9 추가만 허용).",
      "items": {
        "type": "object",
        "additionalProperties": false,
        "required": ["name", "state"],
        "properties": {
          "name": { "type": "string", "pattern": "^[a-z0-9-]+$" },
          "state": { "enum": ["new", "existing"] },
          "note": { "type": "string" }
        }
      }
    },
    "forbidden": {
      "type": "array",
      "minItems": 1,
      "description": "이 티켓에서 명시적으로 금지되는 것. 전역 금지(외부 에셋·Math.random·남의 파일)는 패킷 공통 절이 싣는다 — 여기엔 이 티켓 고유의 금지만 적는다.",
      "items": { "type": "string", "minLength": 1 }
    },
    "model": {
      "enum": ["fable", "opus", "codex", "grok"],
      "description": "E10 §3 배정. fable=디렉터(시스템·통합·판정), opus=단일 최강(픽셀·타이밍 감각 의존), codex/grok=외부 잎 티켓."
    },
    "depends": {
      "type": "array",
      "description": "선행 티켓 id. 순환 금지(manifest-check R5).",
      "items": { "type": "string", "pattern": "^T-P[0-9]-[0-9]{2}$" }
    },
    "status": { "enum": ["todo", "in-progress", "blocked", "done"] },
    "blocked_by": {
      "type": "string",
      "description": "status=blocked 일 때 차단 사유 — HANDOFF 항목 제목 등."
    }
  },
  "allOf": [
    {
      "if": { "properties": { "status": { "const": "blocked" } }, "required": ["status"] },
      "then": { "required": ["blocked_by"] }
    }
  ]
}
