{
  "id": "T-P1-04",
  "type": "interrogation",
  "title": "심문 1건 E2E — 소각 직렬화 포함",
  "owner_files": [
    {
      "path": "src/narrative/interrogation.js",
      "scope": "file",
      "state": "existing"
    }
  ],
  "consumes": [
    {
      "label": "E10 §2 P1 표",
      "doc": "docs/design/E10-production.md",
      "heading": "P1 — 수직 슬라이스 (P0 전체 완료 후 착수)",
      "why": "이 티켓의 정본 행. 내용·소유 파일·의존·수용 기준·모델 배정의 원천이며, 패킷과 어긋나면 이 표가 이긴다."
    },
    {
      "label": "ARCH §2 디렉터리 소유권",
      "doc": "docs/ARCHITECTURE.md",
      "heading": "2. 디렉터리 소유권",
      "why": "자기 소유 파일의 경계 — 표에 없는 파일은 남의 것이다."
    },
    {
      "label": "ARCH §3 모듈 계약",
      "doc": "docs/ARCHITECTURE.md",
      "heading": "3. 모듈 계약",
      "why": "default export 인터페이스와 order 배정 — 신규 모듈은 이 형태여야 등록된다."
    },
    {
      "label": "ARCH §4 Engine API",
      "doc": "docs/ARCHITECTURE.md",
      "heading": "4. Engine API (읽기 전용 계약)",
      "why": "engine.time·bus·state 접근 규약. renderer.render 직접 호출 금지."
    },
    {
      "label": "ARCH §5 이벤트 버스 계약",
      "doc": "docs/ARCHITECTURE.md",
      "heading": "5. 이벤트 버스 계약",
      "why": "이벤트 이름·payload·발신자 정본. 표에 없는 이름을 만들지 않는다."
    },
    {
      "label": "ARCH §11 코드 스타일",
      "doc": "docs/ARCHITECTURE.md",
      "heading": "11. 코드 스타일",
      "why": "ESM·세미콜론 없음·2스페이스·작은따옴표·파일당 500줄·콘솔 0."
    },
    {
      "label": "E5 §1 3선택 판정표",
      "doc": "docs/design/E5-interrogation.md",
      "heading": "1. 3선택 판정표",
      "why": "6행 판정표와 재질문 대체 규칙 — 이 표가 상태기계의 사양이다."
    },
    {
      "label": "E5 §2 소각 경제",
      "doc": "docs/design/E5-interrogation.md",
      "heading": "2. 소각 경제 — 비가역의 규칙 (E1 U1의 시스템 본체)",
      "why": "소각 = unlocks 영구 무효 · 종료 3단 상태식 · 직렬화 의무."
    },
    {
      "label": "E5 §3 재심문",
      "doc": "docs/design/E5-interrogation.md",
      "heading": "3. 재심문·중단·재개",
      "why": "deitch.S4만 재심문 가능 — 그 외는 막이 지나면 닫힌다."
    },
    {
      "label": "E5 §4 막 전환",
      "doc": "docs/design/E5-interrogation.md",
      "heading": "4. 막 전환 (progression — case-graph `progression`과 1:1)",
      "why": "act:enter·act:phase 발화 소유가 이 파일이다."
    },
    {
      "label": "E5 [구현]",
      "doc": "docs/design/E5-interrogation.md",
      "heading": "[구현]",
      "why": "렌더 금지 — 상태·판정만. UI 소유 경계와 이벤트 발화 목록."
    },
    {
      "label": "E3 §3 소각 경제 데이터",
      "doc": "docs/design/E3-case-graph.md",
      "heading": "3. 소각 경제의 데이터 기반 — 단일/이중 경로 배분 (E5가 소비)",
      "why": "단일 경로 3종의 연쇄 손실 구조 — 소각 판정이 이 배분을 지켜야 한다."
    }
  ],
  "inputs": [
    "cg:deitch.S1",
    "cg:deitch.S2",
    "cg:deitch.S3",
    "cg:deitch.S4",
    "cg:deitch.S5",
    "cg:register",
    "cg:keyrack",
    "cg:pressure-log",
    "cg:roofkey"
  ],
  "events": {
    "emit": [
      "interrogation:statement",
      "interrogation:verdict",
      "interrogation:end",
      "evidence:presented",
      "interrogation:prompt",
      "perf:state",
      "act:enter",
      "act:phase"
    ],
    "listen": [
      "interrogation:start",
      "interrogation:choose"
    ]
  },
  "acceptance": [
    {
      "cmd": "node tools/test-interrogation.mjs",
      "expect": "E5 §1 판정표 6행 전이가 배터리로 전건 재현 — 진실×{TRUTH,DOUBT,LIE}·거짓×{TRUTH,DOUBT,LIE정답,LIE오답}"
    },
    {
      "cmd": "node tools/test-interrogation.mjs --burn",
      "expect": "소각 후 해당 진술의 grants/spawns/flags가 재발화되지 않는다 · state 직렬화에 소각 상태가 포함되고 역직렬화 후에도 유지"
    },
    {
      "cmd": "node tools/factcheck.mjs",
      "expect": "F3 PASS 유지 — 최악 소각에서도 진행 불능이 발생하지 않는다"
    },
    {
      "cmd": "node tools/playthrough.mjs --fast --act 1",
      "expect": "act:enter{act:2} 발화가 로그에 1회 기록 · interrogation:end{tier} 발화 — tools/playthrough.mjs 는 T-P1-06 산출이라 이 클론에 없을 수 있다. 없으면 §10.1 반환이 아니라 이 항목을 '대기'로 보고에 표기하고(통과도 면제도 아니다) 부재 증명 출력을 붙인다. 나머지 실행 가능한 수용 기준은 전건 클론에서 실행한다"
    }
  ],
  "shots": [],
  "forbidden": [
    "DOM·캔버스 렌더 — 이 파일은 상태·판정만이다. 3선택 프롬프트·증거 지목 UI는 T-P1-09 소유다.",
    "힌트 신호를 이벤트로 흘리는 것 — 남은 증거 수·정답률·체크 표시 금지(E5 §1 불변).",
    "DOUBT 선제시가 점수 이득이 되게 만드는 것 — 후속 LIE 점수는 DOUBT 점수를 대체한다(누적 아님).",
    "case-graph.json·script.js 수정 — 데이터는 T-P0-03이 이미 정합시켰다.",
    "수동 저장·로드 경로 추가 — 소각 회피 루트가 되어 U1을 무너뜨린다."
  ],
  "model": "codex",
  "depends": [
    "T-P1-01"
  ],
  "status": "todo"
}
