{
  "id": "T-P1-06",
  "type": "tool",
  "title": "완주 봇 — 골든 패스 소비 + 캡처 모드",
  "owner_files": [
    {
      "path": "tools/playthrough.mjs",
      "scope": "file",
      "state": "new"
    }
  ],
  "consumes": [
    {
      "label": "E10 §2 P1 표",
      "doc": "docs/design/E10-production.md",
      "heading": "P1 — 수직 슬라이스 (P0 전체 완료 후 착수)",
      "why": "이 티켓의 정본 행. 내용·소유 파일·의존·수용 기준·모델 배정의 원천이며, 패킷과 어긋나면 이 표가 이긴다."
    },
    {
      "label": "ARCH §9 스크린샷·QA 하네스 계약",
      "doc": "docs/ARCHITECTURE.md",
      "heading": "9. 스크린샷·QA 하네스 계약",
      "why": "qaId 슬러그 정본·qa API 시그니처·샷 엔트리 추가 규약."
    },
    {
      "label": "ARCH §5 이벤트 버스 계약",
      "doc": "docs/ARCHITECTURE.md",
      "heading": "5. 이벤트 버스 계약",
      "why": "이벤트 이름·payload·발신자 정본. 표에 없는 이름을 만들지 않는다."
    },
    {
      "label": "ARCH §10 결정론",
      "doc": "docs/ARCHITECTURE.md",
      "heading": "10. 결정론",
      "why": "Math.random()·Date.now() 금지. rng(seed)·engine.time 만 쓴다."
    },
    {
      "label": "E9 §2 기계 게이트 총목록",
      "doc": "docs/design/E9-gates.md",
      "heading": "2. 기계 게이트 총목록 (goal 루프가 소비하는 통과 조건 은행)",
      "why": "이 티켓이 만들거나 통과해야 하는 게이트의 정의 원문."
    },
    {
      "label": "E2 완주 타임라인",
      "doc": "docs/design/E2-golden-path.md",
      "heading": "완주 타임라인 (최선 루트, 50:00)",
      "why": "봇 시나리오의 진실원 — 행을 {t, action, expect} 시퀀스로 파싱한다."
    },
    {
      "label": "E2 1막",
      "doc": "docs/design/E2-golden-path.md",
      "heading": "1막 — 로비 (0:30–10:30, 10분)",
      "why": "P1 게이트가 요구하는 구간."
    },
    {
      "label": "E2 [구현] 봇 구동 계약",
      "doc": "docs/design/E2-golden-path.md",
      "heading": "[구현]",
      "why": "2모드(--fast/--paced)의 의미론과 무사건 판정 규칙."
    },
    {
      "label": "E2 부록 B 캡처 목록",
      "doc": "docs/design/E2-golden-path.md",
      "heading": "부록 B — 게이트 판정 캡처 대상 목록 (P2·P4 판정 입력)",
      "why": "--capture 가 덤프할 구간의 정본 좌표."
    },
    {
      "label": "AGENTS.md 샷 하네스 규약",
      "doc": "AGENTS.md",
      "heading": "샷 하네스 규약 (병렬 작업 중 필수)",
      "why": "GPU 락·--out 분리·SHOT_PORT 규약 — 봇도 같은 규약을 따른다."
    }
  ],
  "inputs": [
    "doc:docs/design/E2-golden-path.md§1막 — 로비 (0:30–10:30, 10분)"
  ],
  "events": {
    "emit": [],
    "listen": []
  },
  "acceptance": [
    {
      "cmd": "node tools/playthrough.mjs --fast --act 1",
      "expect": "1막 완주 로그 출력 · qa.goto/interact 경로로 증거 4종 획득 · act:enter{act:2} 도달 · exit 0"
    },
    {
      "cmd": "node tools/playthrough.mjs --paced --act 1",
      "expect": "E2 표의 t를 행동 스케줄로 소비 — 행 t에 행동 개시, 지연을 초 단위로 기록. 막 경계 실측이 스케줄 +40% 상한 안, 무사건 간격 ≤3:00"
    },
    {
      "cmd": "node tools/playthrough.mjs --capture first30 --out shots/p1-06",
      "expect": "0:00–0:30 프레임 시퀀스 덤프 — E2 §첫 30초 표의 5행과 초 단위 대조 가능한 파일명(t 각인)"
    },
    {
      "cmd": "node tools/lint-contract.mjs",
      "expect": "위반 0 — 특히 Date.now() 직호출(봇 시간도 결정론적 스텝)"
    }
  ],
  "shots": [],
  "forbidden": [
    "봇이 engine.bus를 직접 발화·구독하는 것 — 구동은 __CECIL__.qa API로만, 관측은 qa.state()/qa.events()로만(ARCH §9).",
    "게임 코드(src/**) 수정 — 봇이 돌지 않으면 그건 qa API의 결함이고 CONTRACT_CHANGE_REQUEST로 반환한다.",
    "E2 표를 봇에 하드코딩 복사 — 표를 파싱해서 소비한다. 표가 정본이다.",
    "Date.now()/Math.random() 직호출 — 봇 실행이 재현 가능해야 판정 입력이 된다.",
    "별도 시퀀스 캡처 도구 신설 — 캡처는 이 봇에 통합한다(E10 T-P1-06)."
  ],
  "model": "codex",
  "depends": [
    "T-P1-01",
    "T-P1-04"
  ],
  "status": "todo"
}
