{
  "id": "T-P1-09",
  "type": "ui",
  "title": "심문 UI — 3선택 프롬프트 + 증거 지목 모드",
  "owner_files": [
    {
      "path": "src/ui/hud.js",
      "scope": "section",
      "section": "심문 3선택 프롬프트 절",
      "state": "existing"
    },
    {
      "path": "src/ui/notebook.js",
      "scope": "section",
      "section": "증거 지목 모드 절",
      "state": "existing"
    }
  ],
  "consumes": [
    {
      "label": "E10 §2 P1 표",
      "doc": "docs/design/E10-production.md",
      "heading": "P1 — 수직 슬라이스 (P0 전체 완료 후 착수)",
      "why": "이 티켓의 정본 행. 내용·소유 파일·의존·수용 기준·모델 배정의 원천이며, 패킷과 어긋나면 이 표가 이긴다."
    },
    {
      "label": "ARCH §5 이벤트 버스 계약",
      "doc": "docs/ARCHITECTURE.md",
      "heading": "5. 이벤트 버스 계약",
      "why": "이벤트 이름·payload·발신자 정본. 표에 없는 이름을 만들지 않는다."
    },
    {
      "label": "ARCH §9 스크린샷·QA 하네스 계약",
      "doc": "docs/ARCHITECTURE.md",
      "heading": "9. 스크린샷·QA 하네스 계약",
      "why": "qaId 슬러그 정본·qa API 시그니처·샷 엔트리 추가 규약."
    },
    {
      "label": "ARCH §11 코드 스타일",
      "doc": "docs/ARCHITECTURE.md",
      "heading": "11. 코드 스타일",
      "why": "ESM·세미콜론 없음·2스페이스·작은따옴표·파일당 500줄·콘솔 0."
    },
    {
      "label": "E5 §1 힌트 금지 불변",
      "doc": "docs/design/E5-interrogation.md",
      "heading": "1. 3선택 판정표",
      "why": "3선택의 의미와 힌트 금지 — 남은 증거 개수·정답률·체크 표시 전부 금지."
    },
    {
      "label": "E5 [구현] UI 소유 경계",
      "doc": "docs/design/E5-interrogation.md",
      "heading": "[구현]",
      "why": "3선택 = hud.js, 증거 지목 = notebook.js, 반환은 interrogation:choose."
    },
    {
      "label": "E8 §1 수사노트",
      "doc": "docs/design/E8-ui.md",
      "heading": "1. 수사노트 (`ui/notebook.js` — 기존 목표 달성분 승계 + v2 확장)",
      "why": "지목 모드의 물성과 기존 1947 종이 소품 기준선."
    },
    {
      "label": "ARCH §9 qa 대리 구동",
      "doc": "docs/ARCHITECTURE.md",
      "heading": "9. 스크린샷·QA 하네스 계약",
      "why": "qa.choose·qa.link·qa.sign·qa.notebook 의 UI 측 구현 의무."
    },
    {
      "label": "AAA-RUBRIC D7",
      "doc": "docs/AAA-RUBRIC.md",
      "heading": "절대 실격 조건 (하나라도 걸리면 그 항목 점수는 0, 루프 재진입)",
      "why": "웹 UI 냄새는 실격이다."
    }
  ],
  "inputs": [
    "cg:register",
    "cg:keyrack",
    "cg:deitch.S2"
  ],
  "events": {
    "emit": [
      "interrogation:choose",
      "interrogation:aiming",
      "deduction:present",
      "deduction:sign"
    ],
    "listen": [
      "interrogation:prompt",
      "evidence:collected",
      "lore:heard"
    ]
  },
  "acceptance": [
    {
      "cmd": "SHOT_PORT=5929 node tools/shoot.mjs --out shots/p1-09 hud-prompt notebook-present",
      "expect": "2샷 성공 · 콘솔 0 · 정지샷에 힌트 요소 0(남은 증거 수·정답률·체크 표시·강조 테두리 없음) · D7 무발생"
    },
    {
      "cmd": "node tools/playthrough.mjs --fast --act 1 --assert-c1",
      "expect": "C1 시퀀스가 봇으로 재현 — qa.choose({sid:\"deitch.S2\", choice:\"LIE\", evidence:\"register\"})가 interrogation:choose를 발신하고 interrogation:aiming{on:true}→{on:false} 전이가 기록된다"
    },
    {
      "cmd": "node tools/playthrough.mjs --fast --assert-qa-ui",
      "expect": "qa.choose·qa.link·qa.sign·qa.notebook 4종이 QA 모드에서 동작하고 비QA 모드에서 비노출"
    }
  ],
  "shots": [
    {
      "name": "hud-prompt",
      "state": "existing"
    },
    {
      "name": "notebook-present",
      "state": "existing"
    }
  ],
  "forbidden": [
    "힌트 표시 일체 — 남은 증거 개수·정답률·체크 표시·정답 후보 강조 전부 금지(E5 §1 불변).",
    "판정 로직 작성 — UI는 선택을 되돌려 줄 뿐이다. 판정은 interrogation.js 소유다.",
    "시스템 폰트·기본 버튼·라운드 코너 카드·이모지 — D7 실격이다. 1947년의 물건으로 읽혀야 한다.",
    "hud.js·notebook.js의 소유 절 밖 편집 — 크로스헤어·기존 노트 면은 [UI] 기존 소유다.",
    "LIE 판정을 증거 확정 전에 발신하는 것 — interrogation:choose는 단일 발화, 증거 확정 시점에만."
  ],
  "model": "codex",
  "depends": [
    "T-P1-04"
  ],
  "status": "done"
}
