{
  "id": "T-P1-11",
  "type": "tool",
  "title": "심문 unlocks 반영 경로 — evidence:granted 소비 배선",
  "owner_files": [
    {
      "path": "src/gameplay/evidence.js",
      "scope": "section",
      "state": "existing",
      "section": "unlocks 소비 절 — evidence:granted 구독과 그 핸들러"
    }
  ],
  "consumes": [
    {
      "label": "E5 [구현] unlocks 반영 경로",
      "doc": "docs/design/E5-interrogation.md",
      "heading": "1. 3선택 판정표",
      "why": "이 티켓의 정본. grants/spawns 의 수집·배치 실체는 GAMEPLAY 소유이고 interrogation 은 통지만 한다는 계약."
    },
    {
      "label": "ARCH §5 이벤트 버스 계약",
      "doc": "docs/ARCHITECTURE.md",
      "heading": "5. 이벤트 버스 계약",
      "why": "evidence:collected 는 gameplay 단일 발신자이고 심문 grants 포함 전 경로가 여기로 수렴한다(v2.3)."
    },
    {
      "label": "ARCH §3 모듈 계약",
      "doc": "docs/ARCHITECTURE.md",
      "heading": "3. 모듈 계약",
      "why": "구독 해제·init 형태."
    },
    {
      "label": "ARCH §11 코드 스타일",
      "doc": "docs/ARCHITECTURE.md",
      "heading": "11. 코드 스타일",
      "why": "ESM·세미콜론 없음·2스페이스·500줄·콘솔 0."
    }
  ],
  "inputs": [],
  "events": {
    "emit": [],
    "listen": [
      "evidence:granted"
    ]
  },
  "acceptance": [
    {
      "cmd": "node tools/test-unlocks.mjs",
      "expect": "전건 PASS. **이 게이트는 네 소유가 아니다** — 발주 세션이 착수 전에 작성했고 현재 U1·U2 가 실패한다(6 passed, 2 failed). 게이트 파일을 고쳐서 통과시키면 §10.1 반환보다 나쁜 위반이다. src/gameplay/evidence.js 만 고쳐 통과시켜라"
    },
    {
      "cmd": "node tools/test-interrogation.mjs",
      "expect": "64/0 유지 — 생산자 쪽 계약을 깨지 않았다"
    },
    {
      "cmd": "node tools/factcheck.mjs",
      "expect": "전 게이트 PASS 유지"
    },
    {
      "cmd": "node tools/lint-contract.mjs",
      "expect": "전체 스캔 출력에서 src/gameplay/evidence.js 행 0건. 전체 스캔 종료 코드는 타 소유 파일의 기존 위반 때문에 1일 수 있다 — 그 경우 자기 소유 파일 행이 0건이면 통과이고, 잔여는 docs/HANDOFF.md 하단에 등재한다"
    }
  ],
  "shots": [],
  "forbidden": [
    "tools/test-unlocks.mjs 를 편집하는 것 — 판정 도구는 구현자 소유가 아니다. 게이트가 요구하는 계약이 틀렸다고 판단하면 고치지 말고 §10.1 로 반환하라.",
    "evidence:collected 를 evidence.js 에서 직접 발화하는 것 — 단일 발신자는 state.addEvidence 다(ARCH §5).",
    "interrogation.js 를 고치는 것 — 생산자 쪽은 T-P1-04 소유이고 이미 정상 발화한다.",
    "qa 절(T-P1-10 소유)을 건드리는 것 — 이 티켓은 unlocks 소비 절만 소유한다.",
    "Math.random()/Date.now() 직호출."
  ],
  "model": "codex",
  "depends": [
    "T-P1-04",
    "T-P1-10"
  ],
  "status": "todo"
}
