{
  "id": "T-P1-02",
  "type": "rig",
  "title": "다이치 리그 — 절차 휴머노이드 + 식별 소품",
  "owner_files": [
    {
      "path": "src/chars/rig.js",
      "scope": "file",
      "state": "new"
    }
  ],
  "consumes": [
    {
      "label": "E10 §2 P1 표",
      "doc": "docs/design/E10-production.md",
      "heading": "P1 — 수직 슬라이스 (P0 전체 완료 후 착수)",
      "why": "이 티켓의 정본 행. 내용·소유 파일·의존·수용 기준·모델 배정의 원천이며, 패킷과 어긋나면 이 표가 이긴다."
    },
    {
      "label": "ARCH §2 디렉터리 소유권",
      "doc": "docs/ARCHITECTURE.md",
      "heading": "2. 디렉터리 소유권",
      "why": "자기 소유 파일의 경계 — 표에 없는 파일은 남의 것이다."
    },
    {
      "label": "ARCH §3 모듈 계약",
      "doc": "docs/ARCHITECTURE.md",
      "heading": "3. 모듈 계약",
      "why": "default export 인터페이스와 order 배정 — 신규 모듈은 이 형태여야 등록된다."
    },
    {
      "label": "ARCH §6 재질 계약",
      "doc": "docs/ARCHITECTURE.md",
      "heading": "6. 재질 계약 (MATERIALS 소유, 전원 소비)",
      "why": "재질은 mat() 경유만. 등록명 밖 이름은 마젠타로 드러난다."
    },
    {
      "label": "ARCH §8 지오메트리 규약",
      "doc": "docs/ARCHITECTURE.md",
      "heading": "8. 지오메트리 규약",
      "why": "베벨·시드 변주·그라운딩·physics 정적 등록·앵커 규약."
    },
    {
      "label": "ARCH §10 결정론",
      "doc": "docs/ARCHITECTURE.md",
      "heading": "10. 결정론",
      "why": "Math.random()·Date.now() 금지. rng(seed)·engine.time 만 쓴다."
    },
    {
      "label": "ARCH §11 코드 스타일",
      "doc": "docs/ARCHITECTURE.md",
      "heading": "11. 코드 스타일",
      "why": "ESM·세미콜론 없음·2스페이스·작은따옴표·파일당 500줄·콘솔 0."
    },
    {
      "label": "E4 §1 다이치 카드",
      "doc": "docs/design/E4-characters.md",
      "heading": "다이치 (마를로 다이치, 51 — 야간 프런트 16년차)",
      "why": "실루엣이 말해야 하는 것 — 목소리 지문·공간 앵커·심문 아크."
    },
    {
      "label": "E4 §3 리그·연기 구현 계약",
      "doc": "docs/design/E4-characters.md",
      "heading": "3. 리그·연기 구현 계약",
      "why": "실루엣 우선(G10)·식별 소품(안경+조끼)·페이셜 없음·rng(seed) 결정론."
    },
    {
      "label": "ARCH §8 앵커 규약",
      "doc": "docs/ARCHITECTURE.md",
      "heading": "8. 지오메트리 규약",
      "why": "chars 모듈이 room:changed 구독 후 npc/deitch 앵커를 찾아 자기 배치한다."
    }
  ],
  "inputs": [
    "doc:docs/design/E4-characters.md§1. 페르소나 카드"
  ],
  "events": {
    "emit": [],
    "listen": [
      "room:changed",
      "game:pause"
    ]
  },
  "acceptance": [
    {
      "cmd": "SHOT_PORT=5922 node tools/shoot.mjs --out shots/p1-02 interrogation-deitch",
      "expect": "샷 1장 성공 · 콘솔 0 · 실루엣만으로 다이치 식별 가능(안경+조끼가 역광 실루엣에서 읽힌다 — G10 판정)"
    },
    {
      "cmd": "node tools/lint-contract.mjs",
      "expect": "전체 스캔 출력에서 src/chars/rig.js 행 0건 — 특히 Math.random( 직호출 금지(리그 변주는 rng(seed))·materials 밖 재질 생성 금지. 타 소유 잔존(kit.js·props.js 반환분·tools 하네스)은 이 티켓의 판정 대상이 아니다"
    },
    {
      "cmd": "SHOT_PORT=5923 node tools/shoot.mjs --out shots/p1-02q interrogation-deitch rig-ground-check",
      "expect": "품질 자체 게이트 — 두 샷 PNG 를 직접 열어 tools/calibration/grader-rig.md 체크리스트(v2)로 자체 채점하고, 통과선(실격 D4·D5 pass · C-G3/C-G4/C-G6/C-G10 각 8점 이상 · style-fit pass)에 도달할 때까지 구현 수정·재촬영을 반복한다. 반복 상한 5회 · 회차별 샷을 shots/self-r<N>/ 에 보존 · 최종 보고에 회차 목록과 자체 채점 JSON 을 첨부한다. 자체 채점 규율: 항목별 8점 경계의 필수 관찰조건마다 화면 증거 좌표를 기록해야 충족으로 친다 — 좌표를 못 대면 미충족으로 계산하고 수정하라(의심스러우면 낮게). 필수 관찰 항목(전부 사진에서 확인 가능해야 한다): 손 — 엄지+손가락 실루엣 분리(캡슐 스텁 금지) · 관절 — 팔꿈치/무릎/손목/발목 굴곡·테이퍼(등단면 튜브·각기둥 금지) · 신발 — 토캡·힐·솔 분리(슬래브 금지) · 몸통 — 조끼·상체의 측면 두께와 흉곽 곡률(평면 카드 금지) · 목-어깨 — 승모근 블렌드(실린더 하드 엣지 금지) · 얼굴 — 이목구비 지오메트리 + 눈알·눈꺼풀(빈 검정 소켓 금지) · 안경 — 렌즈 유리 재질(프레넬 림·반사, 빈 개구부 금지) · 재질 — 4계열(피부 SSS 감·직물·금속·유리) 분리 + 러프니스 변주 최소 2곳(팔꿈치·소맷단 마모, T존 유분 등) · 2차 디테일 — 재봉선+착용 주름 2계열 이상 · 대형 단색 면 0곳(얼굴·손·모자 포함) · 접지 — 밑창 컨택트 코어. 인물 배치는 심문 QA 폴백 [0, 0, -0.42]·yaw 0 고정(배치 이동은 게이밍 간주). 회수 측이 같은 채점기로 3회 블라인드 재채점하며, 자체 채점과 2점 이상 괴리 나는 항목은 그 자체가 결함 기록이 된다"
    }
  ],
  "shots": [
    {
      "name": "interrogation-deitch",
      "state": "existing",
      "note": "심문 카메라 위치 — 실루엣 판독 판정용"
    }
  ],
  "forbidden": [
    "페이셜 리그·표정 블렌드셰이프 — 머리는 자세·시선 방향만이다(E4 §3).",
    "외부 모델·모션 파일 로드 — 지오메트리·스키닝 전부 절차 생성이다.",
    "Math.random() 직호출 — 변주는 core/util.js의 rng(seed)로만. 같은 시드에 같은 리그가 나와야 한다.",
    "연기(perf) 로직 작성 — 상태별 클립은 T-P1-03 소유다. 이 티켓은 리그와 소품까지다.",
    "npc:sighted 발화 — 프리젠스 발화는 레벨 소유다(ARCH §8)."
  ],
  "model": "codex",
  "depends": [
    "T-P0-01",
    "T-P0-03",
    "T-P0-05"
  ],
  "status": "todo"
}