{
  "id": "T-P1-01",
  "type": "level",
  "title": "로비 정식 레벨",
  "owner_files": [
    {
      "path": "src/world/lobby.js",
      "scope": "file",
      "state": "new"
    }
  ],
  "consumes": [
    {
      "label": "E10 §2 P1 표",
      "doc": "docs/design/E10-production.md",
      "heading": "P1 — 수직 슬라이스 (P0 전체 완료 후 착수)",
      "why": "이 티켓의 정본 행. 내용·소유 파일·의존·수용 기준·모델 배정의 원천이며, 패킷과 어긋나면 이 표가 이긴다."
    },
    {
      "label": "ARCH §2 디렉터리 소유권",
      "doc": "docs/ARCHITECTURE.md",
      "heading": "2. 디렉터리 소유권",
      "why": "자기 소유 파일의 경계 — 표에 없는 파일은 남의 것이다."
    },
    {
      "label": "ARCH §3 모듈 계약",
      "doc": "docs/ARCHITECTURE.md",
      "heading": "3. 모듈 계약",
      "why": "default export 인터페이스와 order 배정 — 신규 모듈은 이 형태여야 등록된다."
    },
    {
      "label": "ARCH §4 Engine API",
      "doc": "docs/ARCHITECTURE.md",
      "heading": "4. Engine API (읽기 전용 계약)",
      "why": "engine.time·bus·state 접근 규약. renderer.render 직접 호출 금지."
    },
    {
      "label": "ARCH §5 이벤트 버스 계약",
      "doc": "docs/ARCHITECTURE.md",
      "heading": "5. 이벤트 버스 계약",
      "why": "이벤트 이름·payload·발신자 정본. 표에 없는 이름을 만들지 않는다."
    },
    {
      "label": "ARCH §6 재질 계약",
      "doc": "docs/ARCHITECTURE.md",
      "heading": "6. 재질 계약 (MATERIALS 소유, 전원 소비)",
      "why": "재질은 mat() 경유만. 등록명 밖 이름은 마젠타로 드러난다."
    },
    {
      "label": "ARCH §6.5 조명 계약",
      "doc": "docs/ARCHITECTURE.md",
      "heading": "6.5 조명 계약 (ATMOSPHERE 소유, 레벨이 소비)",
      "why": "광원은 practical()/ambientRig() 경유만. 색온도 2종 이상 공존 의무."
    },
    {
      "label": "ARCH §8 지오메트리 규약",
      "doc": "docs/ARCHITECTURE.md",
      "heading": "8. 지오메트리 규약",
      "why": "베벨·시드 변주·그라운딩·physics 정적 등록·앵커 규약."
    },
    {
      "label": "ARCH §9 스크린샷·QA 하네스 계약",
      "doc": "docs/ARCHITECTURE.md",
      "heading": "9. 스크린샷·QA 하네스 계약",
      "why": "qaId 슬러그 정본·qa API 시그니처·샷 엔트리 추가 규약."
    },
    {
      "label": "ARCH §10 결정론",
      "doc": "docs/ARCHITECTURE.md",
      "heading": "10. 결정론",
      "why": "Math.random()·Date.now() 금지. rng(seed)·engine.time 만 쓴다."
    },
    {
      "label": "ARCH §11 코드 스타일",
      "doc": "docs/ARCHITECTURE.md",
      "heading": "11. 코드 스타일",
      "why": "ESM·세미콜론 없음·2스페이스·작은따옴표·파일당 500줄·콘솔 0."
    },
    {
      "label": "E6 §0 소유권 분할",
      "doc": "docs/design/E6-spaces.md",
      "heading": "0. 소유권 분할 (ARCHITECTURE v2 §2에 반영)",
      "why": "로비 모듈이 덮는 공간 범위 — 로비·프런트데스크·엘리베이터."
    },
    {
      "label": "E6 §1 로비",
      "doc": "docs/design/E6-spaces.md",
      "heading": "로비 (1막) — \"호텔의 얼굴, 은폐의 얼굴\"",
      "why": "조립 사양 정본 — 서사 기능·이벤트·증거·무드(색온도 3종)·재질명·엘리베이터."
    },
    {
      "label": "E6 §2 공통 계약",
      "doc": "docs/design/E6-spaces.md",
      "heading": "2. 공통 계약",
      "why": "room:changed 정본 어휘·qaId 부여 의무·physics 정적 등록·상호작용 밀도 로비 7·앵커 배치."
    },
    {
      "label": "E2 1막 타임라인",
      "doc": "docs/design/E2-golden-path.md",
      "heading": "1막 — 로비 (0:30–10:30, 10분)",
      "why": "로비에서 일어나야 하는 사건의 시각·트리거·산출."
    },
    {
      "label": "STORY §6 환경 서사",
      "doc": "docs/STORY.md",
      "heading": "6. 환경 서사 (대사 없이 읽혀야 하는 것 — 루브릭 N6)",
      "why": "관찰 문구 원문 — 상호작용 7종의 텍스트는 여기서 온다."
    }
  ],
  "inputs": [
    "cg:register",
    "cg:keyrack",
    "cg:flask",
    "cg:pressure-log",
    "cg:lore.pipes",
    "cg:lore.lightwell",
    "cg:lore.1912"
  ],
  "events": {
    "emit": [
      "room:changed",
      "npc:sighted",
      "sfx"
    ],
    "listen": [
      "act:enter",
      "act:phase"
    ]
  },
  "acceptance": [
    {
      "cmd": "SHOT_PORT=5921 node tools/shoot.mjs --out shots/p1-01 lobby-wide lobby-desk lobby-elevator",
      "expect": "3샷 성공 · 콘솔 에러·경고 0"
    },
    {
      "cmd": "node tools/playthrough.mjs --fast --act 1 --room lobby",
      "expect": "room:changed{room:\"lobby\"} 발화 1회 · qa.list()가 qaId 7종(lobby/front-desk·lobby/behind-desk·lobby/under-desk·radio-lobby·lobby-frame·npc/deitch·lobby/elevator) 전건 반환 · 증거 4종(register·keyrack·flask·pressure-log) 상호작용 성립 — tools/playthrough.mjs 는 T-P1-06 산출이라 이 클론에 없을 수 있다. 없으면 §10.1 반환이 아니라 이 항목을 '통합 시 실행 대기'로 보고에 표기하고 건너뛴다(회수·통합 게이트). 나머지 실행 가능한 수용 기준은 전건 클론에서 실행한다"
    },
    {
      "cmd": "node tools/playthrough.mjs --fast --room lobby --stats",
      "expect": "프레임 예산 통과 — high 프리셋 60fps · medium 프리셋 30fps (p95 기준) — tools/playthrough.mjs 는 T-P1-06 산출이라 이 클론에 없을 수 있다. 없으면 §10.1 반환이 아니라 이 항목을 '통합 시 실행 대기'로 보고에 표기하고 건너뛴다(회수·통합 게이트). 나머지 실행 가능한 수용 기준은 전건 클론에서 실행한다"
    },
    {
      "cmd": "node tools/lint-contract.mjs",
      "expect": "전체 스캔 출력에서 src/world/lobby.js 행 0건 — 특히 atmosphere 밖 *Light 생성·materials 밖 재질 생성·500줄. 전체 스캔 종료 코드는 타 소유 파일의 기존 위반 때문에 1일 수 있다 — 그 경우 자기 소유 파일 행이 0건이면 통과이고, 잔여는 docs/HANDOFF.md 하단에 등재한다"
    }
  ],
  "shots": [
    {
      "name": "lobby-wide",
      "state": "existing"
    },
    {
      "name": "lobby-desk",
      "state": "existing"
    },
    {
      "name": "lobby-elevator",
      "state": "existing"
    }
  ],
  "forbidden": [
    "신규 셰이더·렌더 패스·재질 레시피 추가 — 로비는 R6-4 기준선 위의 조립이다(kit/mat()/practical()만).",
    "new THREE.*Light / new THREE.Mesh*Material 직접 생성 — 계약 린트가 커밋을 차단한다.",
    "NPC·시네마틱의 시각 실체를 레벨이 만드는 것 — 레벨은 빈 Object3D 앵커만 놓는다(ARCH §8).",
    "QA 프로브의 레이캐스트 폴백(player.body=null)에 의존하는 것 — 정식 레벨은 physics 정적 등록을 쓴다.",
    "?scene= 진입로·world/atmo/spaces.js 프로브 경로 훼손 — P2 완료까지 병존한다.",
    "core/shotlist.js의 기존 엔트리 수정 — 추가만 허용된다."
  ],
  "model": "opus",
  "depends": [
    "T-P0-01",
    "T-P0-03",
    "T-P0-05"
  ],
  "status": "done"
}
