{
  "id": "T-P1-07",
  "type": "cinematic",
  "title": "첫 30초 시네마틱 cin-intro",
  "owner_files": [
    {
      "path": "src/narrative/cinematics.js",
      "scope": "file",
      "state": "new"
    }
  ],
  "consumes": [
    {
      "label": "E10 §2 P1 표",
      "doc": "docs/design/E10-production.md",
      "heading": "P1 — 수직 슬라이스 (P0 전체 완료 후 착수)",
      "why": "이 티켓의 정본 행. 내용·소유 파일·의존·수용 기준·모델 배정의 원천이며, 패킷과 어긋나면 이 표가 이긴다."
    },
    {
      "label": "ARCH §2 디렉터리 소유권",
      "doc": "docs/ARCHITECTURE.md",
      "heading": "2. 디렉터리 소유권",
      "why": "자기 소유 파일의 경계 — 표에 없는 파일은 남의 것이다."
    },
    {
      "label": "ARCH §3 모듈 계약",
      "doc": "docs/ARCHITECTURE.md",
      "heading": "3. 모듈 계약",
      "why": "default export 인터페이스와 order 배정 — 신규 모듈은 이 형태여야 등록된다."
    },
    {
      "label": "ARCH §4 Engine API",
      "doc": "docs/ARCHITECTURE.md",
      "heading": "4. Engine API (읽기 전용 계약)",
      "why": "engine.time·bus·state 접근 규약. renderer.render 직접 호출 금지."
    },
    {
      "label": "ARCH §5 이벤트 버스 계약",
      "doc": "docs/ARCHITECTURE.md",
      "heading": "5. 이벤트 버스 계약",
      "why": "이벤트 이름·payload·발신자 정본. 표에 없는 이름을 만들지 않는다."
    },
    {
      "label": "ARCH §10 결정론",
      "doc": "docs/ARCHITECTURE.md",
      "heading": "10. 결정론",
      "why": "Math.random()·Date.now() 금지. rng(seed)·engine.time 만 쓴다."
    },
    {
      "label": "ARCH §11 코드 스타일",
      "doc": "docs/ARCHITECTURE.md",
      "heading": "11. 코드 스타일",
      "why": "ESM·세미콜론 없음·2스페이스·작은따옴표·파일당 500줄·콘솔 0."
    },
    {
      "label": "E2 §첫 30초 사양",
      "doc": "docs/design/E2-golden-path.md",
      "heading": "첫 30초 사양 (P2 — 조작 개입 전에 공간·목표·톤 성립)",
      "why": "초 단위 표 — 이 표가 수용 기준이다. 5행을 초 단위로 맞춘다."
    },
    {
      "label": "E7 §2 시네마틱 목록",
      "doc": "docs/design/E7-presentation.md",
      "heading": "2. 시네마틱 목록 (`narrative/cinematics.js` 발주 단위)",
      "why": "cin-intro의 발주 단위와 대본 소유 표기."
    },
    {
      "label": "E7 §1 카메라 문법",
      "doc": "docs/design/E7-presentation.md",
      "heading": "1. 카메라 문법 (N5 — 심문·지목)",
      "why": "기본 상태 — 어깨 너머 40mm, 손각도 진폭 0.15°·0.4Hz. 컷 대신 모션."
    },
    {
      "label": "E8 §3 제스처 게이트",
      "doc": "docs/design/E8-ui.md",
      "heading": "3. 로딩 화면 (P1 필수 — 베이크·컴파일 수 초의 블랙스크린 제거)",
      "why": "0:00 기점 = 첫 입력 제스처 직후. 물소리는 그 뒤에 시작한다."
    },
    {
      "label": "E8 §3 타이틀 통과 신호",
      "doc": "docs/design/E8-ui.md",
      "heading": "3. 로딩 화면 (P1 필수 — 베이크·컴파일 수 초의 블랙스크린 제거)",
      "why": "title:proceed {mode:\"new\"} 수신이 cin-intro 개시의 정본 트리거다 — 메서드 직접 호출이 아니다."
    }
  ],
  "inputs": [
    "doc:docs/design/E2-golden-path.md§첫 30초 사양 (P2 — 조작 개입 전에 공간·목표·톤 성립)"
  ],
  "events": {
    "emit": [
      "cinematic:start",
      "cinematic:end",
      "subtitle",
      "sfx"
    ],
    "listen": [
      "game:pause",
      "title:proceed"
    ]
  },
  "acceptance": [
    {
      "cmd": "node tools/playthrough.mjs --capture first30 --out shots/p1-07",
      "expect": "캡처 시퀀스가 E2 §첫 30초 표 5행과 초 단위로 대조 통과(P2) — 0:04 자막 개시, 0:10 페이드인, 0:22 배지, 0:27 조작권 이양·크로스헤어 페이드인 — tools/playthrough.mjs 는 T-P1-06 산출이라 이 클론에 없을 수 있다. 없으면 §10.1 반환이 아니라 이 항목을 '대기'로 보고에 표기하고(통과도 면제도 아니다) 부재 증명 출력을 붙인다. 나머지 실행 가능한 수용 기준은 전건 클론에서 실행한다"
    },
    {
      "cmd": "node tools/playthrough.mjs --fast --assert-intro",
      "expect": "cinematic:start{id:\"cin-intro\"} → cinematic:end 발화 · 시퀀스 중 힌트 텍스트 0 · 종료 시점에 플레이어 조작권이 이양된다 — tools/playthrough.mjs 는 T-P1-06 산출이라 이 클론에 없을 수 있다. 없으면 §10.1 반환이 아니라 이 항목을 '대기'로 보고에 표기하고(통과도 면제도 아니다) 부재 증명 출력을 붙인다. 나머지 실행 가능한 수용 기준은 전건 클론에서 실행한다"
    },
    {
      "cmd": "node tools/lint-contract.mjs",
      "expect": "전체 스캔 출력에서 src/narrative/opening.js 행 0건 — 특히 Date.now()/performance.now() 직호출(타임라인은 engine.time). 전체 스캔 종료 코드는 타 소유 파일의 기존 위반 때문에 1일 수 있다 — 그 경우 자기 소유 파일 행이 0건이면 통과이고, 잔여는 docs/HANDOFF.md 하단에 등재한다"
    }
  ],
  "shots": [],
  "forbidden": [
    "점프 스케어·초자연 실재 — 실루엣은 물리 인물만, 유령 형상 금지(E7 헤더 불변).",
    "힌트 텍스트·조작 안내 표시 — 0:27 이후 크로스헤어뿐이다.",
    "renderer.render 직접 호출 — 렌더는 pipeline 소유다(ARCH §4).",
    "E2 표에 없는 비트 추가 — 표가 정본이고 초 단위 대조가 게이트다.",
    "심문 카메라 절 작성 — T-P1-08 소유다. 이 티켓은 cin-intro와 타임라인 골격까지다."
  ],
  "model": "opus",
  "depends": [
    "T-P1-01"
  ],
  "status": "done"
}
