{
  "id": "T-P0-03",
  "type": "interrogation",
  "title": "script.js v2 이행 — case-graph 정합·소비자 적응",
  "owner_files": [
    {
      "path": "src/narrative/script.js",
      "scope": "file",
      "state": "existing"
    },
    {
      "path": "src/narrative/case-graph-loader.js",
      "scope": "file",
      "state": "new"
    },
    {
      "path": "src/narrative/interrogation.js",
      "scope": "section",
      "section": "데이터 접근층 — 관계 필드 참조",
      "state": "existing"
    },
    {
      "path": "src/narrative/deduction.js",
      "scope": "section",
      "section": "데이터 접근층 — 관계 필드 참조 · 표출 문자열 1건",
      "state": "existing"
    },
    {
      "path": "src/ui/casebook.js",
      "scope": "section",
      "section": "표출 문자열 — 노트 표지 1건",
      "state": "existing"
    }
  ],
  "consumes": [
    {
      "label": "E10 §2 P0 표",
      "doc": "docs/design/E10-production.md",
      "heading": "P0 — 정지작업 (T-P0-02→T-P0-04 의존 · T-P0-03만 E3 산출 의존 · 나머지 상호 독립)",
      "why": "이 티켓의 정본 행. 내용·소유 파일·수용 기준·모델 배정의 원천이며, 패킷과 어긋나면 이 표가 이긴다."
    },
    {
      "label": "ARCH §2 디렉터리 소유권",
      "doc": "docs/ARCHITECTURE.md",
      "heading": "2. 디렉터리 소유권",
      "why": "자기 소유 파일의 경계 — 표에 없는 파일은 남의 것이다."
    },
    {
      "label": "ARCH §5 이벤트 버스 계약",
      "doc": "docs/ARCHITECTURE.md",
      "heading": "5. 이벤트 버스 계약",
      "why": "이벤트 이름·payload·발신자 정본. 표에 없는 이름을 만들지 않는다."
    },
    {
      "label": "E3 §4 소비 계약",
      "doc": "docs/design/E3-case-graph.md",
      "heading": "4. 소비 계약",
      "why": "script.js는 case-graph id를 그대로 쓰고 관계를 중복 기재하지 않는다 — 소비자 접근은 로더 경유."
    },
    {
      "label": "E5 [위임] 승인 조항",
      "doc": "docs/design/E5-interrogation.md",
      "heading": "[위임]",
      "why": "interrogation.js·deduction.js 데이터 접근층 편집을 소유자가 승인한 범위 — 판정 로직·이벤트 발화 절은 범위 밖이다."
    },
    {
      "label": "STORY §5 심문 스크립트",
      "doc": "docs/STORY.md",
      "heading": "5. 심문 스크립트",
      "why": "대사 원문 정본. 창작 금지 — 이 문장을 그대로 옮긴다."
    },
    {
      "label": "ARCH §5 room:changed 정본 어휘",
      "doc": "docs/ARCHITECTURE.md",
      "heading": "5. 이벤트 버스 계약",
      "why": "기존 코드의 corridor 등 이형 표기를 corridor9 등 정본 어휘로 수렴시킨다."
    },
    {
      "label": "ARCH §0 작품 정의 — 재허구화",
      "doc": "docs/ARCHITECTURE.md",
      "heading": "0. 작품 정의",
      "why": "표출 문자열의 정본 명칭. 화면에 나오는 \"세실\"은 0이어야 하고, 코드 식별자 잔존은 허용된다."
    }
  ],
  "inputs": [
    "cg:deitch.S1",
    "cg:deitch.S2",
    "cg:deitch.S3",
    "cg:deitch.S4",
    "cg:deitch.S5",
    "cg:ruiz.S1",
    "cg:ruiz.S2",
    "cg:ruiz.S3",
    "cg:ruiz.S4",
    "cg:pryce.S1",
    "cg:pryce.S2",
    "cg:pryce.S3",
    "cg:pryce.S4",
    "cg:pryce.S5"
  ],
  "events": {
    "emit": [],
    "listen": []
  },
  "acceptance": [
    {
      "cmd": "node tools/factcheck.mjs",
      "expect": "F1~F4·R1~R3 전건 PASS — script.js의 id가 case-graph와 1:1로 해결되고 관계 중복 기재가 0이다"
    },
    {
      "cmd": "node tools/test-interrogation.mjs",
      "expect": "기존 배터리 전건 통과 — 데이터 접근층 전환이 판정 동작을 바꾸지 않았다"
    },
    {
      "cmd": "grep -n '세실' src/ui/casebook.js src/narrative/deduction.js src/narrative/script.js",
      "expect": "0건 — 노트 표지 \"실종 · 호텔 버질 942호\" · 미제 엔딩 캡션·자막 \"버질은 계속 영업했다\"(E2 부록 A 원문 그대로). 문자열만 교체하고 로직은 건드리지 않는다"
    },
    {
      "cmd": "grep -rn '세실' src/ --include=*.js",
      "expect": "화면 표출 문자열에서 0건 (코드 식별자 __CECIL__ 등은 잔존 허용)"
    },
    {
      "cmd": "node tools/lint-contract.mjs",
      "expect": "display-name 규칙 위반 0(화면 표출 \"세실\" 소멸) · 자기 소유 파일의 max-500-lines 위반 0. 다른 규칙의 기존 위반(재질·조명·분할·tools 범위)은 T-P0-02/04와 계약 재획정 소관이라 이 티켓의 판정 대상이 아니다"
    }
  ],
  "shots": [],
  "forbidden": [
    "STORY §5 대사 원문의 각색·요약·재창작 — 진실원은 STORY이고 script.js는 전사(轉寫)다.",
    "interrogation.js·deduction.js의 판정 로직·이벤트 발화 절 편집 — 승인 범위는 데이터 접근층뿐이다(E5 [위임]).",
    "case-graph.json 수정 — 그래프는 E3 소유다. 그래프가 틀렸다면 CONTRACT_CHANGE_REQUEST로 반환한다.",
    "script.js에 원산지·반박 관계를 다시 적는 것 — 관계는 그래프에만 산다.",
    "표출 문자열 교체를 빌미로 주변 로직·서식을 손보는 것 — 구역 소유는 그 문자열 1건씩이다."
  ],
  "model": "codex",
  "depends": [],
  "status": "todo"
}